{
  "$schema": "https://json-schema.org/draft/2020-12/schema",
  "$id": "urn:routeproof:result:1",
  "title": "RouteProof canonical result schema v1",
  "description": "Stable, host-independent simulation output. Timing and host provenance belong in run.json.",
  "type": "object",
  "additionalProperties": false,
  "required": [
    "schema_version",
    "model",
    "scenario_name",
    "scenario_sha256",
    "events_sha256",
    "assertions_sha256",
    "canonical_sha256",
    "status",
    "events",
    "snapshots",
    "assertions"
  ],
  "properties": {
    "schema_version": { "const": 1 },
    "model": { "const": "ospf_spf_v1" },
    "scenario_name": { "type": "string", "minLength": 1, "maxLength": 128 },
    "scenario_sha256": { "$ref": "#/$defs/sha256" },
    "events_sha256": { "$ref": "#/$defs/sha256" },
    "assertions_sha256": { "$ref": "#/$defs/sha256" },
    "canonical_sha256": { "$ref": "#/$defs/sha256" },
    "analysis_mode": { "const": "n-1" },
    "resilience": { "$ref": "#/$defs/resilience" },
    "status": { "enum": ["pass", "fail", "incomplete"] },
    "incomplete_reason": { "type": "string", "minLength": 1 },
    "completed_snapshots": { "type": "integer", "minimum": 0 },
    "requested_snapshots": { "type": "integer", "minimum": 1 },
    "events": {
      "type": "array",
      "items": { "$ref": "#/$defs/event_result" }
    },
    "snapshots": {
      "type": "array",
      "items": { "$ref": "#/$defs/snapshot" }
    },
    "assertions": {
      "type": "array",
      "items": { "$ref": "#/$defs/assertion_result" }
    }
  },
  "allOf": [{
    "if": { "properties": { "status": { "const": "incomplete" } } },
    "then": { "required": ["incomplete_reason", "completed_snapshots", "requested_snapshots"] },
    "else": { "properties": { "snapshots": { "minItems": 1 } } }
  }, {
    "if": { "required": ["analysis_mode"] },
    "then": {
      "required": ["resilience"],
      "properties": { "assertions": { "items": { "required": ["failure_scope"] } } }
    },
    "else": {
      "not": { "required": ["resilience"] },
      "properties": { "assertions": { "items": { "not": { "required": ["failure_scope"] } } } }
    }
  }],
  "$defs": {
    "route_identity": {
      "type": "object", "additionalProperties": false,
      "required": ["source", "prefix", "origin"],
      "properties": {
        "source": { "$ref": "#/$defs/id" },
        "prefix": { "$ref": "#/$defs/ipv4_prefix" },
        "origin": { "$ref": "#/$defs/id" }
      }
    },
    "redundancy_reduction": {
      "type": "object", "additionalProperties": false,
      "required": ["source", "prefix", "origin", "baseline_next_hops", "remaining_next_hops", "redundancy_lost", "reachable"],
      "properties": {
        "source": { "$ref": "#/$defs/id" },
        "prefix": { "$ref": "#/$defs/ipv4_prefix" },
        "origin": { "$ref": "#/$defs/id" },
        "baseline_next_hops": { "type": "integer", "minimum": 2 },
        "remaining_next_hops": { "type": "integer", "minimum": 0 },
        "redundancy_lost": { "type": "boolean" },
        "reachable": { "type": "boolean" }
      }
    },
    "failure_target": {
      "type": "object", "additionalProperties": false, "required": ["kind", "target"],
      "properties": {
        "kind": { "enum": ["link", "router"] }, "target": { "$ref": "#/$defs/id" }
      }
    },
    "failure_case": {
      "type": "object", "additionalProperties": false,
      "required": ["snapshot_id", "failure", "failed_requirements", "preexisting_failures", "endpoint_outages", "unreachable_routes", "redundancy_reductions"],
      "properties": {
        "snapshot_id": { "type": "string", "minLength": 1, "maxLength": 64 },
        "failure": { "$ref": "#/$defs/failure_target" },
        "failed_requirements": { "type": "array", "items": { "$ref": "#/$defs/id" }, "uniqueItems": true },
        "preexisting_failures": { "type": "array", "items": { "$ref": "#/$defs/id" }, "uniqueItems": true },
        "endpoint_outages": {
          "type": "array", "items": {
            "type": "object", "additionalProperties": false, "required": ["assertion_id", "kind"],
            "properties": {
              "assertion_id": { "$ref": "#/$defs/id" },
              "kind": { "enum": ["source_outage", "destination_outage"] }
            }
          }
        },
        "unreachable_routes": { "type": "array", "items": { "$ref": "#/$defs/route_identity" } },
        "redundancy_reductions": { "type": "array", "items": { "$ref": "#/$defs/redundancy_reduction" } }
      }
    },
    "resilience": {
      "type": "object", "additionalProperties": false,
      "required": ["redundancy_definition", "requested_cases", "completed_cases", "authored_events_ignored", "excluded_components", "baseline_failed_requirements", "cases"],
      "properties": {
        "redundancy_definition": { "const": "ecmp_first_hops" },
        "requested_cases": { "type": "integer", "minimum": 0 },
        "completed_cases": { "type": "integer", "minimum": 0 },
        "authored_events_ignored": { "type": "integer", "minimum": 0 },
        "baseline_failed_requirements": { "type": "array", "items": { "$ref": "#/$defs/id" }, "uniqueItems": true },
        "cases": { "type": "array", "items": { "$ref": "#/$defs/failure_case" } },
        "excluded_components": {
          "type": "array", "items": {
            "type": "object", "additionalProperties": false, "required": ["kind", "target", "reason"],
            "properties": {
              "kind": { "enum": ["link", "router"] }, "target": { "$ref": "#/$defs/id" },
              "reason": { "enum": ["already_down", "endpoint_unavailable"] }
            }
          }
        }
      }
    },
    "id": {
      "type": "string",
      "minLength": 1,
      "maxLength": 64,
      "pattern": "^[A-Za-z0-9][A-Za-z0-9_.-]*$"
    },
    "sha256": {
      "type": "string",
      "pattern": "^[0-9a-f]{64}$"
    },
    "ipv4_prefix": {
      "type": "string",
      "maxLength": 18,
      "pattern": "^(?:[0-9]{1,3}\\.){3}[0-9]{1,3}/(?:[1-9]|[12][0-9]|3[0-2])$"
    },
    "next_hop": {
      "type": "object",
      "additionalProperties": false,
      "required": ["neighbor", "link", "interface"],
      "properties": {
        "neighbor": { "$ref": "#/$defs/id" },
        "link": { "$ref": "#/$defs/id" },
        "interface": { "type": "string", "minLength": 1, "maxLength": 129 }
      }
    },
    "route": {
      "type": "object",
      "additionalProperties": false,
      "required": ["router", "prefix", "origin", "kind", "distance_to_origin", "metric", "protocol_cost", "next_hops"],
      "properties": {
        "router": { "$ref": "#/$defs/id" },
        "prefix": { "$ref": "#/$defs/ipv4_prefix" },
        "origin": { "$ref": "#/$defs/id" },
        "kind": { "enum": ["connected", "ospf"] },
        "metric": { "type": "integer", "minimum": 0, "maximum": 16777214 },
        "distance_to_origin": { "type": "integer", "minimum": 0, "maximum": 16777214 },
        "protocol_cost": { "type": "integer", "minimum": 0, "maximum": 16777214 },
        "next_hops": {
          "type": "array",
          "items": { "$ref": "#/$defs/next_hop" }
        }
      },
      "oneOf": [
        {
          "properties": {
            "kind": { "const": "connected" },
            "metric": { "const": 0 },
            "next_hops": { "maxItems": 0 }
          }
        },
        {
          "properties": {
            "kind": { "const": "ospf" },
            "metric": { "minimum": 1 },
            "next_hops": { "minItems": 1 }
          }
        }
      ]
    },
    "event_result": {
      "type": "object",
      "additionalProperties": false,
      "required": ["id", "sequence", "at_ns", "type", "disposition", "snapshot_sha256", "route_entries", "next_hop_references"],
      "properties": {
        "id": { "$ref": "#/$defs/id" },
        "at_ns": { "type": "integer", "minimum": 0, "maximum": 9223372036854775807 },
        "route_entries": { "type": "integer", "minimum": 0 },
        "next_hop_references": { "type": "integer", "minimum": 0 },
        "sequence": { "type": "integer", "minimum": 1, "maximum": 9223372036854775807 },
        "type": { "enum": ["link_down", "link_up", "router_down", "router_up"] },
        "disposition": { "enum": ["applied", "noop"] },
        "snapshot_sha256": { "$ref": "#/$defs/sha256" }
      }
    },
    "snapshot": {
      "type": "object",
      "additionalProperties": false,
      "required": [
        "id",
        "sequence",
        "event_id",
        "sha256",
        "available_routers",
        "administratively_up_links",
        "routes"
      ],
      "properties": {
        "id": { "type": "string", "minLength": 1, "maxLength": 64 },
        "sequence": {
          "oneOf": [
            { "type": "null" },
            { "type": "integer", "minimum": 1, "maximum": 9223372036854775807 }
          ]
        },
        "event_id": {
          "oneOf": [
            { "type": "null" },
            { "$ref": "#/$defs/id" }
          ]
        },
        "sha256": { "$ref": "#/$defs/sha256" },
        "available_routers": {
          "type": "array",
          "items": { "$ref": "#/$defs/id" }
        },
        "administratively_up_links": {
          "type": "array",
          "items": { "$ref": "#/$defs/id" }
        },
        "routes": {
          "type": "array",
          "items": { "$ref": "#/$defs/route" }
        }
      }
    },
    "path_step": {
      "type": "object",
      "additionalProperties": false,
      "required": ["router", "next_hop", "route_decision"],
      "properties": {
        "router": { "$ref": "#/$defs/id" },
        "route_decision": {
          "type": "object", "additionalProperties": false, "required": ["kind"],
          "properties": {
            "kind": { "enum": ["connected", "ospf", "absent"] },
            "metric": { "type": "integer", "minimum": 0, "maximum": 16777214 }
          }
        },
        "next_hop": {
          "oneOf": [
            { "$ref": "#/$defs/next_hop" },
            { "type": "object", "additionalProperties": false, "required": ["action"], "properties": { "action": { "enum": ["deliver", "source_down", "destination_down", "no_route", "link_down", "next_hop_down", "loop", "incomplete"] } } }
          ]
        }
      }
    },
    "frontier_evidence": {
      "oneOf": [
        {
          "type": "object",
          "additionalProperties": false,
          "required": ["kind", "link", "state"],
          "properties": {
            "kind": { "const": "link" },
            "link": { "$ref": "#/$defs/id" },
            "state": { "enum": ["administratively_down", "endpoint_unavailable"] }
          }
        },
        {
          "type": "object",
          "additionalProperties": false,
          "required": ["kind", "router", "state"],
          "properties": {
            "kind": { "const": "router" },
            "router": { "$ref": "#/$defs/id" },
            "state": { "const": "unavailable" }
          }
        }
      ]
    },
    "finding": {
      "type": "object",
      "additionalProperties": false,
      "required": [
        "assertion_id",
        "kind",
        "source",
        "destination",
        "destination_prefix",
        "destination_origin",
        "ecmp_quantifier",
        "event_id",
        "sequence",
        "scenario_sha256",
        "result_sha256",
        "snapshot_sha256",
        "path",
        "message",
        "terminal_reason",
        "reproduction_argv"
      ],
      "properties": {
        "assertion_id": { "$ref": "#/$defs/id" },
        "kind": { "enum": ["source_down", "destination_down", "no_route", "link_down", "next_hop_down", "loop", "incomplete"] },
        "source": { "$ref": "#/$defs/id" },
        "destination": { "type": "string", "format": "ipv4" },
        "destination_prefix": { "$ref": "#/$defs/ipv4_prefix" },
        "destination_origin": { "$ref": "#/$defs/id" },
        "ecmp_quantifier": { "const": "all" },
        "message": { "type": "string", "minLength": 1, "maxLength": 1024 },
        "event_id": {
          "oneOf": [
            { "type": "null" },
            { "$ref": "#/$defs/id" }
          ]
        },
        "sequence": {
          "oneOf": [
            { "type": "null" },
            { "type": "integer", "minimum": 1, "maximum": 9223372036854775807 }
          ]
        },
        "scenario_sha256": { "$ref": "#/$defs/sha256" },
        "result_sha256": { "$ref": "#/$defs/sha256" },
        "snapshot_sha256": { "$ref": "#/$defs/sha256" },
        "path": {
          "type": "array",
          "items": { "$ref": "#/$defs/path_step" }
        },
        "terminal_reason": { "type": "string", "minLength": 1, "maxLength": 128 },
        "cycle_entry": { "type": "integer", "minimum": 0 },
        "unreachable_origin": { "$ref": "#/$defs/id" },
        "reachable_component": {
          "type": "array",
          "items": { "$ref": "#/$defs/id" }
        },
        "frontier": {
          "type": "array",
          "items": { "$ref": "#/$defs/frontier_evidence" }
        },
        "reproduction_argv": {
          "type": "array",
          "minItems": 2,
          "items": { "type": "string", "minLength": 1 }
        }
      }
    },
    "assertion_result": {
      "type": "object",
      "additionalProperties": false,
      "required": ["assertion_id", "snapshot_id", "snapshot_sha256", "status", "findings"],
      "properties": {
        "assertion_id": { "$ref": "#/$defs/id" },
        "snapshot_id": { "type": "string", "minLength": 1, "maxLength": 64 },
        "snapshot_sha256": { "$ref": "#/$defs/sha256" },
        "status": { "enum": ["pass", "fail", "incomplete"] },
        "failure_scope": { "enum": ["none", "baseline", "network", "source_outage", "destination_outage"] },
        "findings": {
          "type": "array",
          "items": { "$ref": "#/$defs/finding" }
        }
      },
      "allOf": [
        {
          "if": { "properties": { "status": { "const": "pass" } }, "required": ["status"] },
          "then": { "properties": { "findings": { "maxItems": 0 } } },
          "else": { "properties": { "findings": { "minItems": 1 } } }
        }
      ]
    }
  }
}
