{"assertions":[],"assertions_sha256":"4f53cda18c2baa0c0354bb5f9a3ecbe5ed12ab4d8e11ba873c2f11161202b945","canonical_sha256":"29358ab87e013dd1a4780d4588498ba22a0c02d1a60370ff53ef76e7a14aaeb3","events":[{"at_ns":1000000,"disposition":"applied","id":"link_down-ab-1","next_hop_references":0,"route_entries":2,"sequence":1,"snapshot_sha256":"4fd5ec742bba237d299ac85846d08abddbcdfa63eb3cd850c0364ca37f1a5948","type":"link_down"},{"at_ns":2000000,"disposition":"applied","id":"link_up-ab-2","next_hop_references":2,"route_entries":4,"sequence":2,"snapshot_sha256":"3ddef9c762f98ccf3a88f59e74df5b8e8cb5af8442933bcd3508f5d137304474","type":"link_up"}],"events_sha256":"871094eeef117f77bd6dccfdacc131e10c788f6dbb8456416d0b699d665a5e71","model":"ospf_spf_v1","scenario_name":"pair-asymmetric","scenario_sha256":"6b2d106c532302c08fb2288f14be957b2034475b5c4ce18d2ee10cec6fe90d2e","schema_version":1,"snapshots":[{"administratively_up_links":["ab"],"available_routers":["a","b"],"event_id":null,"id":"baseline","routes":[{"distance_to_origin":0,"kind":"connected","metric":0,"next_hops":[],"origin":"a","prefix":"10.10.1.0/24","protocol_cost":2,"router":"a"},{"distance_to_origin":2,"kind":"ospf","metric":5,"next_hops":[{"interface":"ab@a","link":"ab","neighbor":"b"}],"origin":"b","prefix":"10.10.2.0/24","protocol_cost":5,"router":"a"},{"distance_to_origin":7,"kind":"ospf","metric":9,"next_hops":[{"interface":"ab@b","link":"ab","neighbor":"a"}],"origin":"a","prefix":"10.10.1.0/24","protocol_cost":9,"router":"b"},{"distance_to_origin":0,"kind":"connected","metric":0,"next_hops":[],"origin":"b","prefix":"10.10.2.0/24","protocol_cost":3,"router":"b"}],"sequence":null,"sha256":"3ddef9c762f98ccf3a88f59e74df5b8e8cb5af8442933bcd3508f5d137304474"},{"administratively_up_links":[],"available_routers":["a","b"],"event_id":"link_down-ab-1","id":"event-1","routes":[{"distance_to_origin":0,"kind":"connected","metric":0,"next_hops":[],"origin":"a","prefix":"10.10.1.0/24","protocol_cost":2,"router":"a"},{"distance_to_origin":0,"kind":"connected","metric":0,"next_hops":[],"origin":"b","prefix":"10.10.2.0/24","protocol_cost":3,"router":"b"}],"sequence":1,"sha256":"4fd5ec742bba237d299ac85846d08abddbcdfa63eb3cd850c0364ca37f1a5948"},{"administratively_up_links":["ab"],"available_routers":["a","b"],"event_id":"link_up-ab-2","id":"event-2","routes":[{"distance_to_origin":0,"kind":"connected","metric":0,"next_hops":[],"origin":"a","prefix":"10.10.1.0/24","protocol_cost":2,"router":"a"},{"distance_to_origin":2,"kind":"ospf","metric":5,"next_hops":[{"interface":"ab@a","link":"ab","neighbor":"b"}],"origin":"b","prefix":"10.10.2.0/24","protocol_cost":5,"router":"a"},{"distance_to_origin":7,"kind":"ospf","metric":9,"next_hops":[{"interface":"ab@b","link":"ab","neighbor":"a"}],"origin":"a","prefix":"10.10.1.0/24","protocol_cost":9,"router":"b"},{"distance_to_origin":0,"kind":"connected","metric":0,"next_hops":[],"origin":"b","prefix":"10.10.2.0/24","protocol_cost":3,"router":"b"}],"sequence":2,"sha256":"3ddef9c762f98ccf3a88f59e74df5b8e8cb5af8442933bcd3508f5d137304474"}],"status":"pass"}
