{"assertions":[],"assertions_sha256":"4f53cda18c2baa0c0354bb5f9a3ecbe5ed12ab4d8e11ba873c2f11161202b945","canonical_sha256":"064a3cc08cab1ffd0f8ea060062b4d86695b3a11ce74487255ec15439e28ce8d","events":[{"at_ns":1000000,"disposition":"applied","id":"link_down-ab1-1","next_hop_references":2,"route_entries":4,"sequence":1,"snapshot_sha256":"34a4e8cb34a0f0cd1e926c735ed326ae1995ee695253162ef745ba629e7a369c","type":"link_down"},{"at_ns":2000000,"disposition":"applied","id":"link_up-ab1-2","next_hop_references":4,"route_entries":4,"sequence":2,"snapshot_sha256":"8df1db618ac4f58c2942cc7adae013c4aaaf7d7e05b70d53a5c1b64b73d51ad7","type":"link_up"},{"at_ns":3000000,"disposition":"applied","id":"link_down-ab2-3","next_hop_references":2,"route_entries":4,"sequence":3,"snapshot_sha256":"aa3c5603d28fedd925c9943f0dce4da6880a8e1de3ae46ab53a9a69de914803b","type":"link_down"},{"at_ns":4000000,"disposition":"applied","id":"link_up-ab2-4","next_hop_references":4,"route_entries":4,"sequence":4,"snapshot_sha256":"8df1db618ac4f58c2942cc7adae013c4aaaf7d7e05b70d53a5c1b64b73d51ad7","type":"link_up"}],"events_sha256":"6c5fe3d3f53438f110f37c41ebbd4feda2861b524b48168757d3e2ee9bde62f5","model":"ospf_spf_v1","scenario_name":"parallel","scenario_sha256":"d1d4aa949300537c2277c52747875b5e1306a816c8169b29c781ca34f1a7dbb3","schema_version":1,"snapshots":[{"administratively_up_links":["ab1","ab2"],"available_routers":["a","b"],"event_id":null,"id":"baseline","routes":[{"distance_to_origin":0,"kind":"connected","metric":0,"next_hops":[],"origin":"a","prefix":"10.10.1.0/24","protocol_cost":2,"router":"a"},{"distance_to_origin":3,"kind":"ospf","metric":6,"next_hops":[{"interface":"ab1@a","link":"ab1","neighbor":"b"},{"interface":"ab2@a","link":"ab2","neighbor":"b"}],"origin":"b","prefix":"10.10.2.0/24","protocol_cost":6,"router":"a"},{"distance_to_origin":3,"kind":"ospf","metric":5,"next_hops":[{"interface":"ab1@b","link":"ab1","neighbor":"a"},{"interface":"ab2@b","link":"ab2","neighbor":"a"}],"origin":"a","prefix":"10.10.1.0/24","protocol_cost":5,"router":"b"},{"distance_to_origin":0,"kind":"connected","metric":0,"next_hops":[],"origin":"b","prefix":"10.10.2.0/24","protocol_cost":3,"router":"b"}],"sequence":null,"sha256":"8df1db618ac4f58c2942cc7adae013c4aaaf7d7e05b70d53a5c1b64b73d51ad7"},{"administratively_up_links":["ab2"],"available_routers":["a","b"],"event_id":"link_down-ab1-1","id":"event-1","routes":[{"distance_to_origin":0,"kind":"connected","metric":0,"next_hops":[],"origin":"a","prefix":"10.10.1.0/24","protocol_cost":2,"router":"a"},{"distance_to_origin":3,"kind":"ospf","metric":6,"next_hops":[{"interface":"ab2@a","link":"ab2","neighbor":"b"}],"origin":"b","prefix":"10.10.2.0/24","protocol_cost":6,"router":"a"},{"distance_to_origin":3,"kind":"ospf","metric":5,"next_hops":[{"interface":"ab2@b","link":"ab2","neighbor":"a"}],"origin":"a","prefix":"10.10.1.0/24","protocol_cost":5,"router":"b"},{"distance_to_origin":0,"kind":"connected","metric":0,"next_hops":[],"origin":"b","prefix":"10.10.2.0/24","protocol_cost":3,"router":"b"}],"sequence":1,"sha256":"34a4e8cb34a0f0cd1e926c735ed326ae1995ee695253162ef745ba629e7a369c"},{"administratively_up_links":["ab1","ab2"],"available_routers":["a","b"],"event_id":"link_up-ab1-2","id":"event-2","routes":[{"distance_to_origin":0,"kind":"connected","metric":0,"next_hops":[],"origin":"a","prefix":"10.10.1.0/24","protocol_cost":2,"router":"a"},{"distance_to_origin":3,"kind":"ospf","metric":6,"next_hops":[{"interface":"ab1@a","link":"ab1","neighbor":"b"},{"interface":"ab2@a","link":"ab2","neighbor":"b"}],"origin":"b","prefix":"10.10.2.0/24","protocol_cost":6,"router":"a"},{"distance_to_origin":3,"kind":"ospf","metric":5,"next_hops":[{"interface":"ab1@b","link":"ab1","neighbor":"a"},{"interface":"ab2@b","link":"ab2","neighbor":"a"}],"origin":"a","prefix":"10.10.1.0/24","protocol_cost":5,"router":"b"},{"distance_to_origin":0,"kind":"connected","metric":0,"next_hops":[],"origin":"b","prefix":"10.10.2.0/24","protocol_cost":3,"router":"b"}],"sequence":2,"sha256":"8df1db618ac4f58c2942cc7adae013c4aaaf7d7e05b70d53a5c1b64b73d51ad7"},{"administratively_up_links":["ab1"],"available_routers":["a","b"],"event_id":"link_down-ab2-3","id":"event-3","routes":[{"distance_to_origin":0,"kind":"connected","metric":0,"next_hops":[],"origin":"a","prefix":"10.10.1.0/24","protocol_cost":2,"router":"a"},{"distance_to_origin":3,"kind":"ospf","metric":6,"next_hops":[{"interface":"ab1@a","link":"ab1","neighbor":"b"}],"origin":"b","prefix":"10.10.2.0/24","protocol_cost":6,"router":"a"},{"distance_to_origin":3,"kind":"ospf","metric":5,"next_hops":[{"interface":"ab1@b","link":"ab1","neighbor":"a"}],"origin":"a","prefix":"10.10.1.0/24","protocol_cost":5,"router":"b"},{"distance_to_origin":0,"kind":"connected","metric":0,"next_hops":[],"origin":"b","prefix":"10.10.2.0/24","protocol_cost":3,"router":"b"}],"sequence":3,"sha256":"aa3c5603d28fedd925c9943f0dce4da6880a8e1de3ae46ab53a9a69de914803b"},{"administratively_up_links":["ab1","ab2"],"available_routers":["a","b"],"event_id":"link_up-ab2-4","id":"event-4","routes":[{"distance_to_origin":0,"kind":"connected","metric":0,"next_hops":[],"origin":"a","prefix":"10.10.1.0/24","protocol_cost":2,"router":"a"},{"distance_to_origin":3,"kind":"ospf","metric":6,"next_hops":[{"interface":"ab1@a","link":"ab1","neighbor":"b"},{"interface":"ab2@a","link":"ab2","neighbor":"b"}],"origin":"b","prefix":"10.10.2.0/24","protocol_cost":6,"router":"a"},{"distance_to_origin":3,"kind":"ospf","metric":5,"next_hops":[{"interface":"ab1@b","link":"ab1","neighbor":"a"},{"interface":"ab2@b","link":"ab2","neighbor":"a"}],"origin":"a","prefix":"10.10.1.0/24","protocol_cost":5,"router":"b"},{"distance_to_origin":0,"kind":"connected","metric":0,"next_hops":[],"origin":"b","prefix":"10.10.2.0/24","protocol_cost":3,"router":"b"}],"sequence":4,"sha256":"8df1db618ac4f58c2942cc7adae013c4aaaf7d7e05b70d53a5c1b64b73d51ad7"}],"status":"pass"}
